ID,Proposal title,Speaker names,Room,Start,Language,Abstract
7DAVGS,نحو سيناريوهات مفتوحة للتربية الرقمية القائمة على المساواة,Lilia Cheniti,Auditorium 450,2022-05-23T14:00:00+00:00,arabic,"خلال أزمةCovid-19  ، 
لاحظنا أن التعليم المتاح بشكل مفتوح كان فرصة كبيرة لمجتمعات تعليمية مختلفة لا حصر لها، لا سيما في المناطق المحرومة، للاستفادة والوصول إلى الموارد التعليمية وذلك لضمان استمرارية التعليم.
لم يتيح المعروض من التعليم المفتوح إمكانية الحفاظ على دور التعليم باعتباره موجها للتنمية المستدامة للمجتمعات المحرومة وحسب، ولكن مكن المعلمين والمتعلمين من اكتشاف إمكانات هائلة من الموارد والوسائل والخدمات متعددة التخصصات ومتعددة اللغات والتي يمكن الوصول إليها مجانًا.
أهداف التنمية المستدامة (SDGs) 17 هدفًا عالميًا تلتزم الدول بتحقيقها خلال السنوات القليلة المقبلة. تم اعتمادها في 25 يناير 2015، وهي تغطي العديد من المجالات التي تتراوح من حماية الكوكب إلى بناء عالم أكثر سلامًا، بما في ذلك ضمان أن يعيش الجميع بأمان وكرامة. لذلك كان من المهم ضمان نشر وتعزيز هذه الأهداف من خلال المقررات الأكاديمية في الجامعات، وذلك لضمان التزام الشباب بأهداف التنمية المستدامة.
وفي هذا السياق، تم تصميم وتنفيذ مشروعOpen2Sustain ، المستوحى بقوة من هدف التنمية المستدامة الرابع للأمم المتحدة، والذي يبنى على أساس ""ضمان حصول الجميع على تعليم جيد، وعلى أساس المساواة، وتعزيز فرص التعلم مدى الحياة"". المشروع عمل بحثي يجمع شركاء جامعيين من البلدان الأورو-متوسطية حول قضية تتعلق بأهداف التنمية المستدامة. الفكرة المركزية هي تبنى أهداف التنمية المستدامة من قبل جمهور الجامعة من خلال تضمينها في العملية التعليمية اعتمادا على موارد التعليم المفتوح والسيناريوهات التربوية المفتوحة والمبتكرة. بتعبير أدق، هذا المشروع يخلق تعاون بين الشمال والجنوب مما يجعل من الممكن تجميع الخبرات التعليمية المبتكرة ، لدعم البناء المشترك للمعرفة الخاصة بالتنمية المستدامة ، بهدف وضع خطة عمل من أجل دمج أهداف التنمية المستدامة في المقررات الأكاديمية.

بدا لنا على الفور أن العمل على التقاطع بين التعليم المفتوح والتنمية المستدامة في إطار مشروع بحثي يمثل شراكة استراتيجية مهمة تسفر عن شكل جديد من التعاون الأورو-متوسطي. إن إنشاء مساحة للتبادل وللتعاون الأورو-متوسطي تنطوي على شقين : أولاـ التنسيق لقبول أهداف التنمية المستدامة بالبناء على تعزيز التعاون بين الثقافات واللغات المختلفة وثانيا- إطلاق حركة دعوة علمية يمكن أن تحقق تبنيا هائلًا، من قبل مجتمعات المعلمين والمتعلمين، لأهداف التنمية المستدامة. نركز أولاً على السيناريوهات المفتوحة المتعلقة بدمج الهدف الخامس من أهداف التنمية المستدامة ""المساواة بين الجنسين"" في المقررات الجامعية.
نهدف الى إنشاء شبكة من الميسرين للعمل على تبنى الهدف 5 من أهداف التنمية المستدامة في العملية التعليمية في المنطقة الأورو-متوسطية، وذلك من خلال تطوير مقرر من نوع SPOC بشأن الهدف 5 من أهداف التنمية المستدامة وتبادل السيناريوهات المبتكرة المفتوحة القائمة على الموارد التعليمية المفتوحة. لقد لاحظنا بالفعل أن في السنوات الأخيرة يتم نشر المعرفة ويتم التعلم في عالم بلا حدود. في الواقع ، مع تطور تكنولوجيا المعلومات والاتصالات (ICT) والويب، يتشارك منتجو المحتوى التعليمي بشكل متزايد في مواردهم التعليمية [2]. وتُعرف فكرة مشاركة المحتوى الذي يمكن الوصول إليه على الويب بالمحتوى المفتوح [4 ، 5]. بالإضافة إلى ذلك، فإن انفتاح الموارد على المعارف المختلفة والطبيعة الاجتماعية للويب، والواضحة للغاية من خلال المشاركة والتعاون والتجميع والتوزيع، يؤديان إلى جيل جديد من التعلم، مدفوعًا بالانفتاح والتواصل والمشاركة. يحسن التعلم المفتوح موقف الطلاب ويطور مشاركتهم في عملية التعلم.

لذلك هناك حاجة كبيرة لتصميم وتقديم خدمات دعم تعلم إلكتروني فعالة ومفتوحة موجهة لكل من المعلمين والطلاب. تم إتباع نهج يعتمد على عملية التصميم والبحث ADDIE  [1] لإشراك مختلف أصحاب المصلحة في تصميم SPOC  (الحوكمة والأكاديميون والطلاب). في هذه الكلمة، نقدم نهجنا لتحليل احتياجات المقررات الأكاديمية حول أهداف التنمية المستدامة، مما يسمح بإنشاء سيناريوهات مفتوحة على أساس التدريس القائم على المساواة. ثم نقوم بتفصيل عملية تصميم SPOC والتي تقترح سيناريوهات تربوية مفتوحة لدمج الهدف 5 من أهداف التنمية المستدامة في المقررات الأكاديمية بناءً على منهجيةADDIE . 

الكلمات الرئيسية: أصول التدريس المفتوح، أهداف التنمية المستدامة، أصول التدريس القائم على المساواة ، الابتكار التربوي، SPOC

مراجع
[1] Éric Sanchez, Réjane Monod-Ansaldi, « Recherche collaborative orientée par la conception », Éducation et didactique, 9-2 | 2015, 73-94
[2] Hiba Hajri. Personnalisation des MOOC par la réutilisation de Ressources Éducatives Libres. Autre [cs.OH]. Université Paris-Saclay, 2018. Français. NNT : 2018SACLC046. tel-01849443
[3] Li Yuan, Sheila MacNeill et Willem G Kraan. «Open Educational Resources -Opportunities and challenge sfor higher education». In:(2008).
[4] Toru Iiyoshi et MS Vijay Kumar. Opening up education: The collective advancement of education through open technology, open content, and open knowledge. MitPress,2008.
[5] Tom Caswell et al. «Open content and open educational resources: Enabling universal education». In: The International Review of Research in Open and Distributed Learning 9.1 (2008)."
MBYGHK,"Workshop WikiFundi, the offline open source editing plateform",Florence Devouard,Auditorium 450,2022-05-23T14:20:00+00:00,english,"WikiFundi is an open source software that provides an off-line editing environment that mimics the Wikipedia on-line environment. It allows for teaching and content creation when technology fails, access does not exist or is too expensive, and electricity is unreliable. With WikiFundi, individuals, groups and communities can learn how to create and improve articles on a wiki, and can work collaboratively to build articles and other content. To work WikiFundi needs a small portable local server (such as a raspberry PI) that provides a local wifi network, which editors can then connect to and work on their articles. 
Once the articles are finished, the end result can be transferred to an online wiki page on Wikipedia or Wikimedia project or Vikidia.

WikiFundi is a Wiki in Africa project created to support the WikiAfrica movement. The platform is designed by Florence Devouard and Isla Haddow-Flood, and developed by Florence Devouard, Emmanuel Engelhard, Florent Kaisser, Renaud Gaudin, and other members of the Wikimedia community. It is funded by the Orange Foundation, Wikimedia Foundation and Wikimedia CH. The WikiFundi software and its documentation is licensed under CC BY-SA 4.0. WikiFundi received the Open Infrastructure Award from OE Global in 2021.

How WikiFundi can help ?
WikiFundi has been designed to facilitate three distinct sectors:

1. Education : as an easy-to-use teaching tool for schools and education programmes to teach how to read and analyse Wikipedia or Vikidia articles, or to teach how to create and contribute, transferring digital and academic skills. There are resources in the pack to assist students and teachers.
2. Outreach: as a tool that facilitates usergroups and volunteers when building the Wikimedia movement by providing a way to collectively edit in offline situations. There are resources are included in the package to assist Wikimedia leads.
3. Entrepreneurship : as a simple wiki platform used by individuals or small groups of digitally skilled entrepreneurs in poorly connected areas to create CVs, business plans, take meeting notes, produce reports etc..

UseCase: WikiChallenge Ecoles d’Afrique : https://meta.wikimedia.org/wiki/WikiChallenge_Ecoles_d%27Afrique/fr

The goal of the workshop would be to demonstrate how the tool works and how to set it up. And naturally to discuss of its uses....

Links
* https://meta.wikimedia.org/wiki/WikiFundi/en
* http://www.wikifundi.org"
PNN8LV,Open Education Influencers and Capacity Building with OER,Gino Fransman,Auditorium 450,2022-05-23T14:40:00+00:00,english,"The Open Education Influencers project is based at Nelson Mandela University in Gqeberha, South Africa. Started in 2018, the project has focussed strongly upon student empowerment through processes of doing, part of both a personal and professional development strategy for student staff in the LTCollab. An output of this process has seen the successful creation of a student empowerment online course titled ‘Becoming an Open Education Influencer’, or BOEI. BOEI has 6 modules, each intended to empower users to act as facilitators of change, most often in education up to this point, and most usually through the use and creation of Open Educational Resources (OER). In 2021, student leaders at MandelaUni took BOEI as part of their leadership development within the How2Buddies Programme at the institution, moving on to assist thousands of first year entrants into campus life. Several students and staff have supplied feedback to the experience and value of engaging with BOEI, which in this session, is shared with attendees.

In 2022: the OEI project expands its offering by aiming to additionally empower academic and professional staff into the Open sphere. Firstly, staff complete BOEI’s 6 modules, which has a pass mark of 80% per module. Successful participants who express a wish to further their engagements and explorations with Open can apply to be part of the Open Textbooks Fellowship. The OTF is a donor funded empowerment and OER creation project based at the institution under the OEI banner, funded by the Siyaphumelela Programme via the Kresge Foundation. The OTF, currently in its pilot / infancy stage at the time of submitting this proposal, heavily engages the expertise and innovation potential of members of the Open community. In the pilot running Sep to Dec 2021, this included members of Open Education for a Better World, the UCT Open Textbook initiative, and the efforts of that cohort of Open Education Influencers. The 2021 OEGlobal session reports on the pilot, and sets out the project for 2022 in more detail.  As another stakeholder entrant into the 2022 activities, the Nelson Mandela Library is exploring the role it can play in the process, and this strategy will be shared and discussed in the session.

Two Open Textbooks are currently in production as first outputs; one from the 2021 pilot and the 2022 starting points: These are Dr P Kitching’s “Constructive Conversations: An Introduction to Self Coaching for Students,” and Ms N Rayepen’s “Open Education and 5 Performing Arts”. The OTF 2022 project has funding for 5 projects, with recruitment for 3 more underway as of February 2022. Additional funding is set aside to fund consultations and supporting activities to enhance the creation experience. The OEGlobal session shares developments and activities with attendees."
FLULRD,Institutional pedagogical integration of information and communication technologies at the Faculty of Medicine of Tunis,Charfi,Auditorium 450,2022-05-23T15:00:00+00:00,english,"As part of the development of knowledge and institutional transfer of ICT, four innovative projects aimed at excellence in medical education have been launched since 2018. 
The first project involved the establishment of the Digital Pedagogy Committee (CPN) at the faculty of medicine of Tunis (FMT). In an effort to develop FMT teachers’ ICT skills, promote innovation and increase the visibility of the FMT nationally and internationally, the CPN was created in 2018. Workshops aiming to acquire theoretical and practical knowledge specific to a high-quality digital education were established. A quality distance learning (EAD) based on the use of digital tools for medical, interactive and motivating self-learning was also set up. Currently, many courses are presented in hybrid mode at FMT to the graduated and under graduated students of the faculty.  Thanks to the efforts of the dean, to the commitment of its teachers, the FMT, through the CPN, has allowed to establish a new digital culture.

The second project involved the direct involvement of FMT learners in the promotion and adoption of the EAD. In 2020, the ELSOL C+FMT (Covid+ FMT Inclusive Distance Education) project was launched in the context of a national closure obligation for academic institutions at the beginning of the global Covid-19 pandemic. The FMT had, therefore, worked, at best, for this forced transition from the face-to-face system to the EAD. The objectives of the ELSOL C+FMT project were to limit the potential negative scientific and mental impact of the Covid-19 pandemic on access to education. Thanks to the partnership with Associamed and with the 3rd year students of the 2nd cycle of medical studies, the ELSOL C+FMT team assisted the students throughout their experience and collected their feedback. This project also aimed to respect the principle of equity in the medical training of our learners, while adapting resources to the curriculum and their needs. 
Thus, thanks to the solidarity of the different stakeholders at the FMT, this project optimized this experience and made it possible to respect the teaching programs. 

The third project is the establishment of an audio-visual recording studio at the FMT, which was funded by the International Covid-19 price provided by the AUF (Agence Universitaire de la Francophonie) in 2020. Indeed, following an international call for proposals by the AUF, we submitted the ELSOL C+FMT project. Of the 2000 international applications, 96 were selected, including our project, which received a grant agreement. The funds allocated to this project allowed us to set up a recording studio at the FMT in order to promote the enrichment of the production of innovative and quality of audiovisual educational resources. 
The 4th project is the recent implementation of the Pedagogical and Digital Engineering complementary course (CEC) at the FMT. This multidisciplinary and innovative CEC aims to optimize the development of innovation and the creation of a catalogue of educational resources that will be made available to teachers and learners. This CEC is intended for participants from all over Tunisia and from various professional backgrounds: academics, doctors and postgraduate students."
A8UQWW,Keynote 2 (Andres Arauz): Buen Conocer: socially oriented policies at the Ministry of Knowledge of Ecuador,,Auditorium 450,2022-05-24T07:00:00+00:00,spanish,"Ecuador underwent a profound transformation with the Constituent Assembly and a New Constitution in 2008 that elevated “Buen Vivir” (Good Living) as a constitutional paradigm and utopia. It framed human rights in the context of rights of good living and set out a detailed political path for their enjoyment, including education, science, and technology policies. This required a long and careful effort at planning for development, in the context of the twenty-first century. The government was organized into six different sectors, the newest of which was the Knowledge and Human Talent sector.

As the longest-standing Minister of Knowledge of Ecuador, Andres Arauz implemented policies for “Buen Conocer”. It implied the long-term planning of our education policies, new wiki-built legislation for open knowledge, a review of international treaties, new universities, free open software, a biodiversity-focused agenda, and open knowledge procurement policies for access to medicine."
MZBDPR,Beyond the exam: alternative assessment toolkit,Joanne Kehoe,Auditorium 450,2022-05-24T09:00:00+00:00,english,"In support of aims to improve their online teaching and open pedagogy approaches, educators express a need to see exemplar courses and assessment strategies and be able to access just-in-time support and resources (VanLeeuwen et al, 2020) – and this need was made even more critical during the shift to remote teaching during the COVID-19 pandemic. The goal of this project was to provide educators with a comprehensive toolkit to quickly find and integrate new assessment strategies into their teaching. Building new assessment strategies requires investigation, careful consideration, and creation of guiding resources for learners, all of which can be barriers to adoption for many educators. The focus of this project was to eliminate these barriers through the provision of an ‘open online assessment exemplar bank,’ where we will not only categorize and share clear examples, resources and instructions that we have sourced and/or created, but also provide a space for participants to share back adopted or new assessment approaches that have proven successful for their learners and context. The toolkit's aims are to:
•	Introduce alternative online and open assessments and make a case for their use in blended and online learning.
•	Curate high-quality resources and develop tailored content to fill existing gaps.
•	Offer specific assessment ideas and case studies drawn from a wide range of scholarly disciplines and class sizes.
•	Supply boilerplate text to be used or adapted such as assessment instructions, responses to common questions and rubrics.
•	A facilitation guide to help educators make an informed decision about featured assessment strategies, and assist them in implementing them in their teaching.
•	Provide assessment models that involve students and represent diverse perspectives and lived experiences - including international students (both on-campus and abroad) and underrepresented or marginalized students.
•	Enable sharing and building of a bank of community exemplars

Technologies including PressBooks/WordPress, H5P, and other open source tools were used in not
only creating/hosting content but also in modeling how these technologies can be used in building online assessments. The toolkit was developed in Pressbook and leverages the plugins available including accessible H5P content interaction types. A key component of this toolkit is a section built to enable instructors across the spectrum to contribute exemplars, resources, and strategies they have employed.

This session will provide an overview of the collaborative, multi-institutional approach taken to build this resource, sharing of the exemplars and facilitation guide, as well as invite others to contribute to this growing resource of open, online assessments. 

VanLeeuwen, C.A., Veletsianos, G., Belikov, O. Johnson, N. (2020). Institutional perspectives on faculty
development for digital education in Canada. The Canadian Journal of Learning and Technology, 46(2), 1-20. https://www.cjlt.ca/index.php/cjlt/article/view/27944"
WTKVZX,MoodleNet: An Update - Our platform for sharing Open Educational Resources in line with UNESCO's SDG4,Paul Hodgson,Auditorium 450,2022-05-24T09:20:00+00:00,english,"MoodleNet was relaunched in September 2021 as the platform to share open educational content to address UNESCO's Sustainable Development Goal 4: Quality Education.

MoodleNet is open source, free and can be installed and used by any institution and federated with a central global MoodleNet installation to allow anyone to find, curate and re-use open educational resources globally (OER).  MoodleNet has been specifically designed to be used in any effective learning environment and learning management system and is directly integrated with Moodle.

The power of MoodleNet is in bringing educators together around curriculum areas to curate, and develop resources, as well as engage in professional learning and development. These communities are not siloed, but exist across federated instances of MoodleNets.

By taking this federated approach with MoodleNet, we give development partners a place to publish of their own which is also connected to millions of educators worldwide. We can link deeply with teaching tools of all kinds, and ensure that there is a virtuous cycle of review to ensure that quality education prevails."
8RTKUQ,Open up the Metavers!,"Perrine de Coetlogon, Nicolas Dupain",Auditorium 450,2022-05-24T09:40:00+00:00,french,"Open Education Global promeut l’éducation comme est un droit humain fondamental, pour étendre son accès au niveau mondial, dans un contexte où la demande dépasse l’offre et les coûts peuvent être exorbitants. Avec la pandémie de Covid-19, apprendre à distance est devenu une nécessité et la mutualisation des technologies et des scenari le permettant aussi. 

Dans la révolution éducative en marche, les expériences d’apprentissage immersif collaboratif devraient pouvoir être vécues et partagées par le plus grand nombre. 

France Immersive Learning est une association visant à offrir une plateforme open source pour le développement d’une plateforme de classes virtuelles, d'actions collectives d'ingénierie pédagogique de conception et de développement des usages. Cela démultipliera les possibilités et la qualité de l’apprentissage à distance et/ou d’hybridation, mais aussi de réunions de bonnes pratiques ou de travail en lien direct avec les préoccupations de l'éducation ouverte. Les scenari pourront ainsi être mutualisés, ou des expériences vécues en mobilité virtuelle beaucoup plus efficientes (par exemple, un TP de chimie).

Les travaux déjà réalisés et le projet global seront présentés, avec le réseau Open Education Global Francophone."
