ID,Proposal title,Speaker names,Room,Start,Language,Abstract
7BBJVX,Blockchain technologies achievements in pan-European education,"Perrine de Coetlogon, Pierre Valiorgue",Auditorium 450,2022-05-24T10:00:00+00:00,french,"En lien avec les technologies open source et l'open education, Perrine de Coëtlogon, université de Lille, anime depuis 2017 le groupe de travail Blockchain Education France et représente aujourd'hui la France dans le Partenariat Européen de la Blockchain. Comment repenser l'objet diplôme au 21ème siècle, opérer la transformation des services de scolarité, concevoir l'open badge comme le bitcoin du diplôme ou tout simplement, travailler sur une autre approche des compétences avec l'université Lyon 1, qui sera représentée pour ce learning lab par Pierre Valiorgue. 

Entre octobre et décembre 2021, ce sont plus des trois-quarts des diplômes et certificats délivrés en 2020 par l’université de Lille qui ont été émis sous la forme d’une attestation numérique « à valeur probante ». L’Université de Lille est le premier à réaliser à cette échelle une véritable transformation numérique de sa direction de la scolarité en émettant à ses étudiant·e·s une attestation numérique de réussite au diplôme ou au certificat ancré dans une blockchain à faible coût énergétique. 

L’étudiant·e reçoit un lien pérenne vers un document web infalsifiable et vérifiable, traduit en anglais, qu’il ou elle pourra présenter à un employeur, une association ou en poursuite d’études, en France et à l’étranger, permettant de vérifier l’authenticité du diplôme.

Réalisé en collaboration avec BCdiploma et le GIP Renater, ce projet de transformation numérique a été mis en œuvre dans le cadre du partenariat européen blockchain (EBP). L’objectif est de permettre à tous les établissements d’enseignement supérieur nationaux et européens d’émettre ces attestations en s’appuyant notamment sur l’expérience acquise par l’Université de Lille dans le cadre du projet gouvernemental européen fr.EBSI.

Le Learning Lab permettra à tous de comprendre certains aspects de cette technologie complexe, les idées en contexte éducatif et aussi l'intérêt du projet d'infrastructure européenne de service blockchain pour réinventer les services publics. Avec l'Unesco, d'autres pistes sont envisagées, en lien direct avec l'open education."
87MCNR,"Open textbook authorship, quality assurance and publishing: Social justice models of participatory design, engagement, co-creation and partnership",Glenda Jayne Cox,Auditorium 450,2022-05-24T12:00:00+00:00,english,"Growing inequity continues to manifest within and between higher education institutions of the Global North and Global South, highlighting the plight of the disadvantaged versus the advantaged in the system (Holscher & Bozalek, 2020). In addition to the challenge of high university fees impeding access, there are challenges related to the cost and appropriateness of textbooks in higher education (Cox et al., 2019) – all of which have been exacerbated by the COVID-19 pandemic and the widening inequality that has manifested as a result (Hargreaves, 2021). 

Internationally, research has highlighted the importance of providing access to textbooks and online educational resources in order to maximise returns on remote learning necessitated by the pandemic, particularly in the context of unequal access to learning materials and curricula (Mishra et al., 2020; Reimers & Schleicher 2020). 

At the University of Cape Town (UCT), academics are exploring the affordances of open textbooks and alternative content creation approaches in order to address limitations around the accessibility and relevance of traditional textbooks.

This presentation is framed by the work of political philosopher Nancy Fraser (2005), who aims to illuminate the injustices of gender inequality, racism, colonialism and neoliberalism. In order to do so, she proposes a multi-level theory of justice, in which she describes three dimensions of social injustice: 1) economic maldistribution; 2) cultural misrecognition;and 3) political misframing. These “species” of injustice are objects that need to be dismantled (Fraser, 2005, p.92). Fraser provides a set of tools and principles that can be used to examine the current injustices in higher education.

The central norm of Fraser’s theory is “parity of participation”. This is a principle of “equal moral worth”, in that justice requires social arrangements in which all are able to participate as equal peers in social life (Fraser, 2009, p.16). Overcoming injustice, therefore, means dismantling the institutional obstacles that prevent people from participating on a par with others. This parity of participation can be both an outcome “where all relevant actors participate” and a process “in fair and open processes of deliberation” (Fraser, 2005, p.87).

Fraser (2005) provides two “frames” or “remedies” for injustice (p.98). An affirmative remedy may redraw boundaries, or even create new ones within the existing political frame, and accepts the “who” (that is, the given collection of “subjects” in an established hierarchy) of the current political community. It does therefore not challenge the underlying “deep grammar” of injustice (Fraser, 2005, p.99). A transformative remedy challenges the underlying frame-setting or grammar, which is “out of synch” and causes injustice. A transformative approach to misframing goes beyond changing the boundaries of “who” is included, to questioning “how” those boundaries are drawn. Fraser (2005, p.100) suggests the “all-affected principle” as a frame to aspire to: “all those affected by a given social structure or institution have moral standing as subjects of justice in relation to it.”

The work of Bovill (2020) is used in conjunction with Fraser (2005) in order to examine the manner in which open textbooks enable collaboration and co-authoring with peers and students. Bovill proposed a framework that can be used to describe the range of activities and roles that colleagues and students take on, namely: participatory design, student engagement, co-creation (in the capacity of co-researcher, co-designer, co-designer and/or representative) and partnership.  

The work shared in this presentation emerges from research conducted within the Digital Open Textbooks for Development (DOT4D) project, an open textbook research, implementation and advocacy initiative which investigates the current ecosystem of open textbook publishing and provides implementation support in open textbook publishing activity at the University of Cape Town (UCT). The project operates with an underlying social justice agenda, in that it interrogates economic maldistribution, cultural misrecognition and political misrepresentation in the context of open textbook provision using Fraser’s (2005) social justice framework.  

The data presented draws from a mixed-method research and implementation approach conducted in the Digital Open Textbooks for Development (DOT4D) project over a three-year period with 11 open textbook authors at the University of Cape Town (UCT). These activities included a survey administered to all 11 authors; grant proposals submitted by 10 of the authors in the DOT4D grants programme, and two rounds of in-depth interviews with five authors from the study sample. These specific activities were supported by the DOT4D project field notes tracking interactions with the UCT open textbook community. 

Analysis of the data involved identifying key aspects of open textbook production and publishing, namely authorship, quality assurance and publishing, that emerged in each of the authors’ initiatives and examining the various approaches undertaken. Each author’s approach is analysed against Bovill’s (2020) framework of inclusion.

The presentation demonstrates how academics at UCT are embarking on open textbook initiatives in response to a largely mutual set of social injustices they witness in their classrooms related to affordable access, curriculum transformation and multilingualism. With a focus on student co-creation and inclusion, it presents models that address social (in)justice in the classroom and explores ways in which institutions can address sustainability in order to support open textbook development activity.

Four models are identified and positioned in Fraser’s continuum.  In order to rate the extent of the “remedy” using the affirmative and transformative frames of Fraser (2005), a heat map will also be introduced to illustrate the positioning of models on the conceptual spectrum. An affirmative remedy is the participatory/engagement model, while the participatory/engagement/co-creation model has components of transformative justice. Two models are transformative: a co-creation model and a partnership/co-creation model. These transformative “remedies” restructure (and potentially destabilise) the underlying principles of textbook creation to allow for true representation and reframing. 

This presentation will provide insights into inclusive approaches towards the authorship, quality assurance and publishing of open textbooks. It will also be of interest to anyone interested in social justice-driven models of open educational resources and mechanisms for how to support this activity in a resource-constrained environment as part of an institutional transformation agenda."
CZGKBL,The road to the open university - A teacher education project as a driver of innovation?,"Benjamin Heurich, Bence Lukács",Auditorium 450,2022-05-24T12:20:00+00:00,english,"We would like to present previous measures as well as the remaining roadmap of our Open Science project at the University of Passau. The focus so far has been on Open Educational Resources (OER), which are a central element of the interdisciplinary project SKILL.de (Strategies for Competence Development: Innovative teaching formats in teacher education, digitally enhanced"") In this context, among other things, an OER policy has emerged, whose development process we would also like to trace in our contribution. While the SKILL.de project is related to teacher education, our current efforts also include other subjects and disciplines.

Our contribution, which we would like to present is composed in detail as follows: 

- Virtual tour of our Digital Innovation Labs (OER-Lab, DiLab - Digitalized Classroom & Teachers’ Room) at the University of Passau. 
- Presentation of selected innovative openness projects from research and teaching.
- Presentation, outlook and discussion: From the development of our OER policy to the establishment of an Open Science culture. 

As project collaborators, we are currently in the second funding period of the project. SKILL.de is funded by the Federal Ministry of Education and Research as part of the joint quality initiative for teacher education of the federal and state governments in Germany. Since the beginning of the second funding period, we have been focusing on innovative teaching and learning strategies in the area of Open Educational Resources, on testing flipped and smart classroom concepts, and on competence development in the area of eEducation, in line with the newly acquired name affix ""digitally enhanced"". 

Digitization as a process of technological transformation on the one hand and a process of cultural and social transformation on the other brings about new forms of collaboration and requires critical media skills. The University of Passau takes up this development, especially in teacher education. Therefore, our work has been supported by an OER policy developed collaboratively in the project from the very beginning. Accordingly, we are optimistic to be able to give other pioneers important impulses for the departure into the unknown. 

In detail, we locate our contribution mainly on the thematic session of 'Pathways to Opening up Education' for the following reasons: 

In university work, both in teaching and research, our commitment to the Open Science and Open Education paradigms is driving fundamental changes in working practices and communication structures (or infrastructures). For this purpose, we have very well-equipped innovation spaces at our disposal, where we can plan OER projects and test them together with schools and other educational institutions. We would like to present selected projects and initiatives that have emerged from our work within these innovation spaces so far and discuss them together with the attendees. Furthermore, we would like to address problems and hurdles that have arisen while trying to establish a culture of transparency on the one hand, and methods of addressee-oriented and sustainable preparation of teaching-learning materials as OER on the other hand. Additionally, we believe that mutual inspiration and an open exchange of experiences on and about our project are extremely important. We hope to be able to benefit from the numerous expertises and experiences of all those present who have already followed this or a similar path in parts or as a whole. Overall, while our project serves as a catalyst for teacher education, we are also committed to driving structural change within our university, towards an openness that promises to transform the way we work and communicate scientifically. The foundation for this open-science approach can be built and fostered in different places within the university, but also in its periphery. Therefore, we consider any input and an open exchange of experiences with many sectors, stakeholders and work areas to be extremely valuable. 

The newly-anchored digitized collaboration should enable a more effective and open exchange of information within the university, as well as the associated social and educational space. Ultimately, we would like to drive a holistic, innovative and social transformation process of scientific research results into society and follow our OER policy in the medium term with a strategy to implement sustainable Open Science and Open Education."
EPDE8E,An institutional OER policy as a basis for systemic change in the adoption of open education,"Michiel de Jong, Nicole Will",Auditorium 450,2022-05-24T12:40:00+00:00,english,"Open Education has been embraced by Delft University of Technology for a long time by participating in initiatives like open courseware, MOOC’s and the more recently introduced publication of open textbooks. However this is just a small part of all of the educational materials that are used and produced within the university. It requires a real systemic change to transition educational resources to open alternatives, including activities like: 
-	Support for teachers who design their own teaching materials, making them into OER;
-	Raising teacher’s awareness on existing OER in their field and support with taking inventory of potentially useful OER;
-	Negotiating copyright contracts with publishers to make commercial literature available for use in OER;
-	Developing teacher training for open education skills;
-	Providing advice to management for including open education into their policy;
-	Support with instructional design for open education practices, including the active participation of students in the creation and development of OER.
In this presentation, we will share our strategy for encouraging and supporting these changes. Part of this strategy is including open education into the university’s open science program, as well as starting conversations within the faculties and involving stakeholders to create awareness of OER and copyright, developing a narrative around open education that addresses the different target audiences within the university, starting small good practices and building on to larger, more ambitious projects. All of this has gone hand in hand with the development of an institutional Open Educational Resource (OER) policy.
We perceive the publication of the OER policy that impacts so many players involved in education as a key development within systemic change that we also want to highlight in particular. We want to share the journey towards realizing this policy, as well as the resulting document. In addition, we want to show how we have perceived that with this institutional policy, we see a change in the willingness to adopt open education across campus as a new way of working with educational resources, in large part due to the active involvement of the various stakeholders. We hope to serve as an inspiration to other schools and education institutions by showcasing the various pioneering activities and strategic decisions that we have made to facilitate open education as a new standard in teaching."
C7LLCU,Optimiser l’impact du soutien à la création et à l’utilisation de REL en enseignement supérieur,"Claude Potvin, marianne dube",Auditorium 450,2022-05-24T14:00:00+00:00,french,"L’un des buts avoués de la fabriqueREL, une structure organisationnelle relevant de trois universités partenaires subventionnée par le ministère de l’Enseignement supérieur du Québec, est de faire des REL le support d’enseignement privilégié en enseignement supérieur au Québec. Pour atteindre ce but, il est nécessaire de promouvoir les avantages et bénéfices des REL. Cela nécessite d’avoir de la documentation de qualité en français, de réfléchir à une stratégie de communication et d’intervention pour arriver à ces fins. Plusieurs questionnements peuvent se poser : Quels acteurs cibler? Vaut-il mieux travailler avec les directions d’établissements, avec les enseignants, avec le personnel professionnel ou à la base même avec les étudiants? Quels messages privilégier? Que les REL permettent de faire des économies, que les REL sont écoresponsables? Qu’elles permettent l’expression et la diffusion de sa culture et de sa créativité? 

Dans cette présentation, nous exposerons les données et indicateurs recueillis dans le réseau de l’enseignement supérieur (enquêtes terrain, consultations des partenaires, réponses aux appels à projets, statistiques de fréquentation) sur lesquels la fabriqueREL s’est appuyée afin de planifier ses orientations annuelles depuis ses débuts en 2019. Nous passerons en revue la période d’implantation de la fabriqueREL (an 1), puis sur une période de partage de ressources d’enseignement pendant la pandémie COVID-19 (an 2), puis à un appel à projets universitaire tous formats (an 3), et enfin cette année à un appel à projets orientés sur le format texte (manuels et notes de cours) ouvert à l’ensemble des établissements en enseignement supérieur (an 4). Enfin, nous envisagerons quelques possibilités pour l'avenir de la fabriqueREL. 

Nous conclurons avec un échange avec les personnes de l’assistance sur les stratégies qu’elles adoptent pour promouvoir l’appropriation des REL dans leur milieu respectif."
MQHZBQ,Defining and Developing ‘Enabling’ Open Education Policies in Higher Education,"Javiera Atenas, Catherine Cronin, Igor Lesko, Cristina Stefanelli, Virginia Rodés",Auditorium 450,2022-05-24T14:20:00+00:00,english,"Policies are part of the essential infrastructure of higher education – communicating priorities, clarifying expectations, defining rights and responsibilities, managing risk, and supporting decision-making. Alongside the pandemic in 2020, the terrain of higher education changed dramatically. With this came a growing recognition that many higher education policies ––specifically for digital, online and open teaching, learning and assessment–– did not sufficiently meet the needs of students, staff and institutions; and/or that the necessary policies did not exist.

Precision is needed when discussing higher education policy, as the deceptively simple word is used to describe instruments that operate at multiple levels, e.g. institutional policies, sectoral policies, national policies, European policies, etc. In this Thematic Session, we share both a definition and a process for developing ‘enabling’ policies to support those engaged in, and committed to, developing open education policies in various higher education contexts. Such policies may include OER policies, open textbook policies, and other policies in the domains of Open Education, Open Science and Open Knowledge.

Prefacing policy with the word ‘enabling’ suggests that there are aspects of any policy that make it more enabling than non-enabling for stakeholders who are affected by and/or engaged with it. Enabling policies can be defined as those which fulfil a range of criteria across the categories of policy content, policymaking process, and policy form and style (National Forum, 2021):
Policy content – supports an integrated approach; includes an implementation plan and procedures.
Policymaking process – is collaborative, with a focus on collective ownership; is equitable, diverse and inclusive; builds on existing student-staff partnership approaches; ensures that the process scope is defined broadly; engages experts, where required. 
Policy form and style – is clear, concise and easily communicable to all stakeholders; is supportive, flexible and practical; is accessible by all. 

Across different contexts, and subject to diverse and complex priorities and challenges, a democratic process of policy “co-creation” (see Atenas et al., 2020) ensures that enabling policies are developed in an open, transparent, participatory way – ensuring that those who will be affected by the policy also share ownership of the policy. To support the development of enabling policies for open education in higher education, the following five steps are recommended:

Identify need for policy
Co-create policy (consult and collaborate; research and analysis; design and redraft; evaluate and review)
Approve policy
Implement and communicate policy
Monitor and review policy

In this Thematic Session, a transnational group of educators will discuss a shared understanding of how enabling open education policies can be developed in higher education. This approach is not specific to any country, region or higher education system. The group will share  a policy brief collectively developed and co-created, adapted from and building on a recent openly-published guide to developing enabling policies (National Forum, 2021), to provide opportunities for those engaged  and willing to be engaged in institutional policy development for open education (particularly learning and teaching) to discuss aims and challenges, to share resources, and to consider approaches relevant to their own contexts in order to co-create sustainable and enabling Open Education policies.



References:

Atenas, J., Havemann, L., Neumann, J., & Stefanelli, C. (2020). Open Education Policies: Guidelines for co-creation. Zenodo. https://doi.org/10.5281/zenodo.4281363 

National Forum for the Enhancement of Teaching and Learning in Higher Education (2021).  Guide to Developing Enabling Policies for Digital and Open Teaching and Learning. https://hub.teachingandlearning.ie/resource/guide-to-developing-enabling-policies-for-digital-and-open-teaching-and-learning/"
PLFXTH,Wheel of insight - Connecting learning materials to support learning objectives,Leontien van Rossum,Auditorium 450,2022-05-24T14:40:00+00:00,english,"For teachers, it is not always clear what type of learning material can best be used in a specific context. That context is partly determined by the learning outcomes to be achieved in the course and the desired didactic approach. This tool called the ‘Wheel of insight’ connects learning materials to support specific learning objectives. And in doing so, provides insight into which type of learning material is best suited for the desired didactic approach. 

When using this tool, teachers and support staff determine at first which of the six cognitive learning goals (based on the revised taxonomy of Bloom) is applicable for the course. For example, the course focuses on analysing. 
Second the consideration of the didactic methods which are described by means of actions. E.g. do you want student to participate, discuss or solve problems? 
As a result, the tool suggests which types of learning materials can best be used. Each suggestion is supported by evidence, described in one or more scientific articles. Currently, the tool is based on ~100 articles. 
 
The articles are indicated with: 
•	a green lock: indicates Open Access 
•	a grey lock: indicates a paywall and is possible to access, for example, via an institution   
 
The idea of the tool is inspired by the Padagogy Wheel as a resource, where educational apps and learning outcomes are linked.  
 
During the presentation we hope to give insight and spread awareness amongst participants to analyse which type of learning materials are available in their own institutions and the opportunities it could bring to enrich education. 
 
This Wheel of insight is the product of the Dutch Acceleration plan - Educational innovation with ICT, Zone Towards digital (open) educational resources. (https://www.versnellingsplan.nl/en/towards-digital-open-educational-resources/)"
