ID,Proposal title,Speaker names,Room,Start,Language,Abstract
93LQCS,Favoriser une culture REL francophone pancanadienne,Catherine Lachaîne,Auditorium 450,2022-05-24T15:00:00+00:00,french,"En 2019, le groupe de travail sur l’éducation ouverte de l’Association des bibliothèques de recherche du Canada (ABRC) a été établie dans le but offrir des conseils d’experts pour assurer la pertinence continue des activités en matière d’éducation ouverte de l’ABRC et pour créer des occasions de qualité pour les bibliothécaires du Canada afin de renforcer la capacité et les compétences de leadership dans ce domaine (ABRC, 2019a). Après un fructueux premier mandat, le groupe de travail fût renouvelé pour un deuxième mandat de 2020-2022. 

Durant le premier mandat, les membres ont complété une analyse du contexte des modèles de soutien à l'éducation ouverte auprès d'environ 250 établissements postsecondaires au Canada (Askin et al., 2019). En plus de faire état des initiatives, services, et programmes offerts dans les établissements postsecondaires dans chaque région du Canada, le rapport fait également mention des écarts au niveau de la langue. On constate que la grande majorité des REL adoptées, adaptées et créées dans le secteur postsecondaire au Canada sont de langue anglaise et qu’il faut réduire l’écart qui se creuse entre les REL de langue française et les REL de langue anglaise. Les REL de langue française représentent une solution alternative à la pénurie de textes commerciaux en français et adaptés aux contextes canadien et québécois, compte tenu de la dimension plus modeste de ce marché. Également, l’adaptation de REL existantes de langue anglaise représentent une approche pratique pour combler cet écart à court terme, mais à long terme, afin d’assurer l’équité, il est essentiel de promouvoir une culture de création de REL  en français en rendant disponibles, non seulement une infrastructure, mais aussi un soutien financier. Les REL de langue française représentent une opportunité de créer l’égalité des chances parmi la minorité linguistique francophone et de rendre l’éducation postsecondaire en français plus accessible partout au Canada.

La première année du groupe de travail s’est conclu en janvier 2020 à Toronto avec l’événement Notions fondamentales de leadership en éducation ouverte (ABRC, 2019b), une formation de deux jours conçue par le groupe de travail afin d’offrir aux bibliothécaires canadiens l’information, les compétences et les ressources nécessaires pour diriger des initiatives d’éducation ouverte. Bien que majoritairement anglophone, une petite délégation francophone à pris part à l’événement et de bonnes discussions ont eu lieu et ont déterminé les besoins du côté francophone et l’importance de tisser des liens entre les francophones au Canada et ce qui se passe du côté anglophone. Il est primordial de mettre en commun les discussions et les efforts pour faire avancer l’éducation ouverte au Canada.  

Le deuxième mandat du groupe de travail national s'est plutôt développé sous forme de sous-groupes, pour avancer certains dossiers, dont un sous-groupe sur les REL et l’éducation ouverte francophones. Le mandat de ce sous-groupe est de proposer des activités favorisant le relais et la diffusion d’information relativement aux dossiers REL pour les communautés francophones canadiennes (ABRC, 2022). Le but du sous-groupe est de faire les premiers pas vers une “communauté de pratique” pancanadienne sur les ressources éducatives libres parmi les institutions postsecondaires canadiennes francophones. Puisque les communautés francophones sont dispersées à travers le pays, il est important de créer des opportunités de rencontres et d’échanges pour les différents intervenants dans la pratique de l’éducation ouverte (ABRC, 2022). 

L’objectif de cette présentation éclaire est de présenter le sous-groupe de travail sur les REL et l’éducation ouverte francophone au Canada et de faire un survol des réalisations et activités du sous-groupe dans les deux dernières années, dans le but de répondre aux besoins des communautés francophones au sujet des REL et de l’éducation ouverte. Parmi les activités et tâches accomplit, il y a:
  
- 3 appels communautaires, sur des thématiques choisies, pour rassembler les principaux pratiquants en éducation ouverte et également toute personne intéressée sur le sujet. Les appels étaient ouverts à tous. 

- L’adaptation et la traduction de la documentation sur meilleures pratiques d’attribution avec les licences Creative Commons, de Creative Commons Wiki.

- La révision du contenu en français sur le site de l’ABRC et ainsi que l’ajout de ressources en français sur les REL et l’éducation ouverte.

- Le développement d’une programmation francophone pour la Semaine de l’éducation ouverte 2022, y compris des Vitrines REL pour mettre en valeur des projets lancés dans les dernières années. Cette programmation est le fruit de nouvelles collaborations, développées entre autres avec des rencontres durant les appels communautaires. 

Nous considérons que ce modèle de collaboration communautaire, avec un mandat précis de répondre aux besoins des communautés francophones au Canada, est une voie prometteuse, ouverte et inclusive, pour réduire les écarts entre les langues et mettre de l’avant les réalisations et le travail en français des éducateurs, bibliothécaires et tout autres parties prenantes dans le milieu de l’éducation ouverte. 


Références

ABRC. (2019a). Groupe de travail sur l’éducation ouverte. https://www.carl-abrc.ca/fr/faire-avancer-la-recherche/communication-savante/education-ouverte/gteo/ 

ABRC. (2019b). Événement – Notions fondamentales de leadership en éducation ouverte. https://www.carl-abrc.ca/wp-content/uploads/2019/09/OeLE_plan_programme_fr.pdf 

ABRC. (2022, février). Sous-groupe de travail sur les REL francophones - Mandat.  https://docs.google.com/document/d/1Q-I4pzOW4VTmX-hoo1wTE2VHs_-fPMY8YxgCcH7zJhs/edit?usp=sharing 

Askin, N., Brunet, M., Coughlan, R., Daniels, C., Durnin, J., Khetarpal, M., Ludbrook, A., Morrison, L. et Smith, A. (2019). Analyse du contexte du service et du soutien à l’éducation ouverte au Canada. Association des bibliothèques de recherche du Canada. https://www.carl-abrc.ca/wp-content/uploads/2020/06/GTDO_analyse_du_contexte_fra.pdf"
WCWCQM,Keynote 3 (Carine Bernault): Why and how are we opening up Nantes Université?,,Auditorium 450,2022-05-25T07:00:00+00:00,english,"Nantes University is an excellent, sustainable and open university. Openness is in its DNA, its statutes affirm: “The development of knowledge commons is a key element of social progress. Anxious to contribute to this essential objective, Nantes University is resolutely committed to open science, open educational resources and open innovation in order to make knowledge accessible to all”. Why make Nantes University an open university? How to share knowledge more widely? This talk will be an opportunity to discuss how a university can make a concrete commitment in promoting the sharing of knowledge.

Nantes Université est une université excellente, durable et ouverte. L’ouverture est dans son ADN, ses statuts affirment : « Le développement de biens communs du savoir est un élément clé du progrès social. Soucieuse d’apporter sa contribution à cet objectif essentiel, Nantes Université s’engage résolument en faveur de la science ouverte, des ressources éducatives libres et de l’innovation ouverte afin de rendre les connaissances accessibles à tous ». Pourquoi faire de Nantes Université une université ouverte ? Comment partager plus largement les connaissances ? Cette intervention sera l’occasion d’échanger sur la manière dont une université peut s’engager concrètement pour favoriser le partage des connaissances."
8R3NR7,The cartography of an OER. Towards a more permeable and organic OER ecosystem.,"Caroline Kuhn, Michelle Harrison, Irwin Devries",Auditorium 450,2022-05-25T09:00:00+00:00,english,"Researchers and educators alike have considered the role of OEP more effectively engaging learners in collaborative pedagogies, with a focus on the co-creation of knowledge and critical uses of digital approaches by using a variety of open tools and platforms. At the same time, many of these practices are still tied to existing artefacts and sometimes archaic systems, and even our open textbooks and associated technologies can feel static, closed and sterile. In a series of open and collaborative projects focused on rethinking the lives of OERs, we have been considering how we can better open our spaces to student voices, to encourage more equitable practices, and to expand our own conceptions of the possibilities of what OERs can do. This is not something new or personal to us, as it is recognised, in the latest webinar series run in May 2021 by the OER Dynamic Coalition, that there is a lack of understanding about how we go from theory to practice, that is, how do we use and make OER sustainable and regenerative. 
We are curious to know more about how we build an OER landscape (ecosystem) that allows for recontextualizing, reframing, and extending, to promote academic skills but also to include participation as a member of an ongoing critical community of scholars/authors/creators/critics? How can our OERs move beyond their initial conception, to not only be “kept alive” but to continue to thrive and grow, by evolving, improving and being integrated in other communities of users/contributors? 
In this Learning Lab session we will explore our current projects where we have been experimenting in innovative ways with the open textbook format and share how our collaboration and discussion has created new connections. 
Our main focus will be to engage in an activity and discussion about how we sustain and grow our OERs, considering how a regenerative approach might help build a network of users and authors.  We have more questions than answers, but we hope these can be nurtured by the community and will provide a space to delve into ways that others have engaged in embracing OEP to help sustain their own OERs. We want to offer an experimental space to participants where they will trace the life of their OERs, mapping them physically on a Mercator projection to explore at which point they have become sterile, that is they have stopped growing and transforming thus, regenerating. This exercise will allow the audience to discuss in groups what can be potential reasons for this and how we can find ways to morph the existing structure of OERs, in particular, open textbooks, so that we can together create new pathways to more permeable and organic OER ecosystems."
7KQ88B,Inter-professional synergistic contribution to the development of policies and strategies for the inclusion of OER in the pedagogical and documentary schemes of French public higher education,"Cecile Swiatek Cassafieres, Carole Schorlé-Stefan",Auditorium 450,2022-05-25T09:20:00+00:00,english,"Open Educational Resources are one of the levers for implementing Open Education, but also one of the paths towards multiplicity and plasticity of formats/structuring of learning paths, learning methods and teaching practices.
 
This presentation discusses the challenges of including OER in pedagogical and documentary frameworks that support learning and teaching strategies. It demonstrates the benefits of bringing together diverse professional communities in pedagogy and documentation, knowing and defining each community's areas of expertise to ensure dynamic complementarity. This is most effective when the approaches of the various professions come together within the framework of a shared strategic vision.
 
This presentation brings together a panel of speakers from the various professional communities in French higher education and research, who will demonstrate, through concrete and illustrative examples, how national policies and institutional strategies for OER benefit from bringing together dynamic actors from complementary professional and inter-professional networks within a common and shared vision. An ongoing dialogue between the various professional communities, which places the learner at the heart of the teaching arrangements, promotes the design and implementation of living pedagogical models, marked by the diversity and richness of approaches offered to each institution and to each teacher and trainer. Such an approach also facilitates the multiplicity and flexibility of learning practices for students and citizens who access these educational resources produced and made accessible by the services of public higher education institutions.
 
The paper opens with a presentation by a national expert on OER, of the French Open Science policy framework that includes OER, and the policy related to data, algorithms and source code that touches on the same topics. UNESCO, in its 2019 recommendation on OER, urges states to develop supportive policies at national as well as institutional levels, and to "" develop strategies to enable the use and adaptation of OER in support of high quality, inclusive education and lifelong learning for all"". France, a CONOSC member country, has had a National Open Science Plan (PNSO) since 2018 and, since 2021, a national framework on public data, algorithms and source codes.
It is in this general context that the French public higher education system is embarking on a policy of OER development that is based on already established realities. Higher education is characterised by the principle and practice of academic freedom: it is through the actions of its institutions and by drawing on the dynamism of professional associations and educational and documentary networks that French public higher education produces policies and strategies. It is these same actors who translate these strategies into actions and (good) practices that aim to include the design, use and discoverability of OER, among other resources, in the pedagogical and learning arrangements of higher education and lifelong learning.
 
A representative of the public professional communities in higher education dedicated to the development of digital learning presents how, since the launch in the early 2000s, the various French OER repositories aligned with disciplinary fields and even more so since their integration into L’Université Numérique. French higher education institutions have implemented many pilot projects revolving around the use of OER and how it enhances the students’ learning experience. With the onset of the pandemic, this hybridisation of courses has dramatically increased and reached beyond early adopters to become more or less mainstream. In addition, OER are now routinely used in curriculum development and are key enablers to move forward on new approaches around competencies and micro-credentialing. L’Université Numérique federates French higher education and universities around the creation and use of OER in French in several disciplinary fields: economics, management, engineering, healthcare, the humanities and sports. Together with ICDE and the French Ministry for Higher Education, Research & Innovation, it leads the activities of the Francophone working group on OER, within the framework of UNESCO’s dynamic coalition for OER. Its various projects and partnerships involve many French-speaking African nations, such as the Republic of Congo, Côte d’Ivoire, Madagascar, Mali, Senegal and Togo. L’Université Numérique also has partnerships with major players in the anglophone world: ICDE, MERLOT and the OER Foundation and its Learning in the Digital Age courses.
 
The session then focuses on the fundamental role played by libraries in the open science and open knowledge ecosystem. A representative of the national professional communities of academic and research libraries presents the fields of expertise and know-how of academic and research libraries and Learning Centres. For the libraries, the action undertaken by the teams at the institutional level is to be matched with their active communities and professional networks at the national level in France, at the European level and at the international level. Academic and research libraries have shown strong leadership with Open Access, and they have been very active in advancing Open Science in the last two decades. Academic libraries and Learning Centres are a key player in equally supporting Open Education and particularly OER, and leading action in areas close to their core work. Librarians are known as effective and visionary partners and leaders, as open information and knowledge managers, facilitators, and disseminators thanks to their expertise in metadata and discovery services. Libraries enable, support and enhance creation, access, re-use, adaptation, sharing and redistribution of educational resources. Their collaborative philosophy and practices identify Libraries as major partners for institutional teaching and learning and research support departments. They also play an essential role as skilled and qualified educators and trainers in information literacy, and facilitate pedagogical innovation.
 
In France, the national consortium Couperin.org (Consortium unifié des établissements universitaires et de recherche pour l'accès aux publications numériques), a non-profit association financed by the fees of member institutions and subsidised by the Ministry of Higher Education, Research and Innovation, provides a vision, expertise and active contribution on OER, focusing on the evolution of economic models for electronic resources in the landscape of educational publishing and, more generally, of open science. Indeed, Couperin.org aims to build and develop a national network of competences and exchanges in the field of electronic documentation, notably concerning acquisition policies, collection development plans, information systems, publishers' invoicing models, access ergonomics, and usage statistics. Couperin.org evaluates, negotiates and organises the purchase of digital documentary products at the best price for the benefit of its members, with a particular focus on the evolution of business models in the publishing field. A representative of Couperin.org presented the way in which the consortium works directly on the provision of free educational and research resources, and invests in the emergence of new models through the provision of free and open access e-textbooks. 
 
The last part of the presentation is dedicated to an exchange and discussion between the panel of speakers and the audience. This talk is open to all, policy makers, OER professionals, teachers, engineers, librarians, students, curious citizens, without prerequisites. It will be conducted in English, and will be accompanied by a bilingual French/English handout that will provide useful resources for further exploration."
R9XLXQ,Some thoughts about sustainable OER. It’s all about ownership!,"Robert Schuwer, Ben Janssen, Jan-Bart de Vreede",Auditorium 450,2022-05-25T09:40:00+00:00,english,"In a time when a lot of energy is spent on launching new OER initiatives there is often a lot of enthusiasm for starting something, but quite often less attention is given to the question “how do we make this last”. Or in other words, how can we make this initiative sustainable? Sustainability is often defined as the ability of a project to continue its activities beyond the project phase. Of course, the idea of continuation is a crucial part of the meaning of sustainability. A number of business models focus on this point (Downes, 2007; De Langen, 2013; Tlili et al, 2020). However, there is a much more important aspect to the issue of sustainability, namely the question of why an OER project is being undertaken: what do we ultimately want to achieve with adoption of OER? Therefore, a view on sustainability should have a broader approach than simply the financial aspect. That is in line with (Downes, 2007) and (De Langen, 2013), but they mainly focus on the viability of the projects themselves. We want to include the context of the projects: who is doing it and why? What are the goals and the strategy to achieve the goals? Is OER part of a short- or long term perspective on open education?

In this session we will provide perspectives on this topic through the lens of considering OER as public goods.

(More details in the attached PDF)"
SCELZW,The Truth is Out There: Dutch Nursing realized sustainable adoption of OER,"Robert Schuwer, Marja Versantvoort",Auditorium 450,2022-05-25T10:00:00+00:00,english,"Many initiatives for adoption of OER start as a project, financed by a one-time grant. Although ambitions may be different, too often the initiative is not continued when the project has ended (Orr et al, 2015). The question what approach leads to a sustainable practice for OER initiatives has ongoing relevance. Several studies are available for addressing the question “Is there still life after the grant?” (Downes, 2007; Tlili et al, 2020). One of the methods is making a professional Community of Practice (CoP) responsible for the quality and timeliness of the OER. Several successful examples are available where the project succeeded in creating a vibrant CoP maintaining an OER collection (Smith & Lee, 2016; Lambert, 2019). But Tlili et al (2020) also observed that many projects do not succeed in this endeavor, ending up with an unmanaged and unused collection of OER.

In 2017, a project was started that should ultimately lead to a situation in which 17 Dutch institutions of higher education with a Bachelor Nursing program create, share and reuse OER. In this project, much attention was given to create a vibrant professional Community of Practice (CoP) to realize a sustainable situation. Two grants were available for the initial period of 3 years. After this period, 11 institutions decided to continue for another five years working towards mainstreaming of OER, with a central role for the CoP. 

To gain more insights into how project activities have led to the current situation, and how the role of the CoP in the way towards a sustainable way of sharing and reusing OER has developed, a study is undertaken. 

This study analyses how the project has progressed on a national level and what changes this has brought about within the participating institutions. The study answers the following questions: 
1.	How did the project proceed? 
2.	Which elements contributed positively to the project result and which did not, and why? 
3.	What has been the process of teachers adopting sharing and reuse of OER? 
4.	What lessons can be learned from this project? 
5.	What advice can be given to the Continuing Together Bachelor Nursing project and to other parties wishing to start a similar project? 

In the presentation, the project, method of the study and the results are described.

References
Downes, S. (2007). Models for sustainable open educational resources. Interdisciplinary Journal of e-Skills and Lifelong Learning, 3, 029-044. https://doi.org/10.28945/384 
Lambert, S. (2019). The Siyavula case: Digital, collaborative text-book authoring to address educational disadvantage and resource shortage in South African schools. lnternational Electronic Journal of Elementary Education, 11(3), 279-290. https://doi.org/10.26822/iejee.2019349252
Orr, D., M. Rimini and D. Van Damme (2015), Open Educational Resources: A Catalyst for Innovation, Educational Research and Innovation, OECD Publishing, Paris. http://dx.doi.org/10.1787/9789264247543-en 
Smith, B., & Lee, L. (2016). Librarians and OER: Cultivating a community of practice to be more effective advocates. Journal of Library & Information Services in Distance Learning, 11(1-2), 106-122. https://doi.org/10.1080/1533290x.2016.1226592
Tlili, A., Nascimbeni, F., Burgos, D., Zhang, X., Huang, R., & Chang, T. (2020). The evolution of sustainability models for open educational resources: Insights from the literature and experts. Interactive Learning Environments, 1-16. https://doi.org/10.1080/10494820.2020.1839507"
