ID,Proposal title,Speaker names,Room,Start,Language,Abstract
NVVWFJ,"Keynote 1 (Dr. Sian Proctor): Space2inspire: fostering an open, creative, and J.E.D.I. space!",,Auditorium 450,2022-05-23T08:00:00+00:00,english,"Dr. Sian Proctor will engage in a thought-provoking and inspiring discussion on how we are currently writing the narrative of human spaceflight and how that has implications for the future of education. In this motivating keynote, she breaks down how Open Educational Resources and the evolving Web3 space are rapidly transforming the way we learn, live, work, and play as we extend humanity to the Moon, Mars, and beyond. We will look at how Web3 is creating communities, distributing knowledge, spearheading policy, and incentivizing creativity. Together, we will dive into redefining ownership on the blockchain and the implications for creating a just, equitable, diverse, and inclusive space ( a J.E.D.I. space) both on Earth and within the Metaverse.

BIOGRAPHY

Dr. Sian Proctor is a geoscientist, explorer, space artist, and astronaut. She was the mission pilot for the SpaceX Inspiration4 all-civilian orbital mission. She is the first black female to pilot a spacecraft and the first black commercial astronaut. She is also one of The Explorer’s Club 50: Fifty People Changing the World. Her motto is called Space2inspire where she encourages people to use their unique, one-of-a-kind strengths, and passion to inspire those within their reach and beyond. She believes that we need to actively strive for a J.E.D.I. space: a just, equitable, diverse, and inclusive space as we advance human spaceflight.

She uses her afrofuturism space art to encourage conversations about women of color in the space industry. She believes that when we solve for space, we also solve issues on Earth and she promotes the adoption of space technology in regards to issues such as food waste and climate change.

Dr. Proctor spent 21 years as a professor teaching geology, sustainability, and planetary science at South Mountain Community College, in Phoenix, Arizona. She is currently the director of the Global Futures Institute for the Maricopa Community College District."
KEQTSP,Développement d’OER au travers d’un Open Learning Lab,Christine Jacqmot,Auditorium 450,2022-05-23T12:00:00+00:00,french,"Développement d’OER au travers d’un Open Learning Lab
Yves Deville (UCLouvain), Christine Jacqmot (UCLouvain) 

Contexte
*********
Depuis 2015, l’UCLouvain s’est engagée dans un projet fort d’université numérique dans laquelle le numérique favorise la création, la diffusion et l’acquisition de connaissances. Après un premier plan stratégique initié en 2015, un second plan stratégique pour l’Open Education, l’Open Science et la Formation à Distance (1) a confirmé, en 2021, la stratégie d’ouverture par le numérique (Deville, 2021).

De pionnière, l’UCLouvain est passée en moins de 10 ans à un statut d’université de référence pour sa stratégie en Open Education, pour ses résultats obtenus dans le domaine des MOOCs pour la formation à distance, pour ses ressources éducatives libres et pour son recours aux outils numériques en soutien à l’apprentissage et à l’enseignement. 

Mais l’effort doit être poursuivi et étendu. Dans cette communication, nous présentons un nouveau projet qui fédèrera, à partir de mi-2022, huit institutions belges d’enseignement supérieur, partenaires dans un projet commun et novateur, basé sur l’Openness au service du développement professionnel des enseignants. 

Le projet
**********
Un plan de relance européen permettra aux Institutions d’Enseignement Supérieur de la Fédération Wallonie-Belgique de mettre en place dès 2022 des projets visant à réduire les fractures numériques sous ses différentes formes (fracture d’accès aux infrastructures numériques, fracture dans l’utilisation du numérique, fracture de compétences numériques et fractures d’accès aux ressources numériques …). Dans ce contexte, les axes d’actions qui émergent assez classiquement visent l’accès à l’équipement informatique, le développement d’infrastructures, le déploiement d’espaces numériques d’enseignement et d’apprentissage, la formation des étudiants à la littératie numérique. 
A l’UCLouvain, nous avons souhaité adresser également le développement des compétences numériques des enseignants. 
En cohérence avec notre stratégie et nos principes d’Openness, nous avons proposé à un ensemble d’institutions d’enseignement supérieur d’inscrire elles aussi la formation de enseignants dans leur projet et de s’associer au sein d’un Open Learning Lab (OLL) dont nous assurerons la coordination.  Ce projet se base sur un mode Open, ce qui est nouveau pour la plupart de nos partenaires. 
Les principes fondateurs que nous avons proposés pour adhérer et rejoindre le OLL sont simples et souples, à dessein : 
•	Chaque institution consacre une partie librement déterminée du budget de son propre projet obtenu dans le cadre du plan de relance économique, sous forme de ressources humaines dédiées à la formation de compétences numériques de ses enseignants  (formateurs, conseillers ou ingénieurs techno-pédagogiques).
•	Il n’y a aucun flux financier entre institutions.
•	Chaque institution développe les formations jugées pertinentes pour ses propres enseignants.
•	Tous les matériaux et parcours de formation des enseignants développés dans le cadre l’OLL sont réalisés en mode Open. Ces ressources sont mises à disposition des partenaires mais également de tous les centres d’appui à la pédagogie et de développement pédagogiques du monde entier en étant publiés sous la forme d’OERs sur la plateforme dédiée aux ressources éducatives libres oer.uclouvain.be, sous  licence CC-BY-NC.
•	Au cours d’une Open Learning Week, organisée au moins une fois par an, l’ensemble des formateurs proposent les formations ainsi mises au point et rassemblées dans un programme collectif à l’ensemble des enseignants des institutions partenaires.
•	Les équipes de conseillers et formateurs se rencontrent régulièrement pour se coordonner, échanger, identifier les synergies et collaboration, en ce compris les besoins de formations communes des techno-pédagogues.

A ce jour, huit institutions belges d’enseignement supérieur ont décidé de répondre à notre invitation et de rejoindre ce projet fédérateur d’Open Learning Lab.  

Pourquoi ne feriez-vous pas de même ? 
****************************************
Le projet d’Open Learning Lab a une double vocation.  Il s’agit d’une part d’intensifier et d’enrichir l’offre des formations liées au numérique et d’accompagner les enseignants dans leur maitrise des outils et technologies.  D’autre part, ce projet vise au développement et à la dissémination de l’approche Open, y compris dans ses aspects collaboratifs et selon une approche que nous voulons pérenne.

Pourquoi fédérer des institutions autour de l’Openess ?
•	Le recours aux ressources ouvertes, c’est-à-dire libres, gratuites et réutilisables, contribue à l’accès aux savoirs à tous et tout au long de la vie, y compris en termes de développement professionnel des enseignants.  
•	En termes de « OER capacity building », mettre le principe d’ouverture en pratique au niveau du développement professionnel des enseignants est cohérent et efficace pour les sensibiliser à l’ouverture des matériaux et ressources pédagogiques. C’est pourquoi, au sein du projet OLL, un effort tout particulier sera dédié à la documentation (ressources et parcours de formation des enseignants), en format ouvert. 
•	La mise en œuvre d’une collaboration autour de l’Openess est plus aisée à mettre en œuvre car cela ne nécessite pas de flux financier et garantit à chaque partenaire de bénéficier de tous les résultats du projet.

Pourquoi développer l’accompagnement et les formations liées au numérique auprès des enseignants dans un laboratoire fédérateur ?
•	La mobilisation efficace d’outils numériques dans les dispositifs d’apprentissages et l’intégration de ces dispositifs numériques dans les pratiques pédagogiques est une voie naturelle et authentique pour le développement des compétences numériques des étudiants. 
•	La formation des enseignants est indispensable pour que ces derniers puissent mobiliser adéquatement et efficacement les outils numériques dans leurs approches pédagogiques. 
•	A l’UCLouvain, le Louvain Learning Lab (LLL) contribue depuis de nombreuses années à améliorer la qualité de la formation et de l’apprentissage des étudiants de l’UCLouvain.  Cet incubateur de nouvelles approches pédagogiques accompagne les enseignants et favorise l’usage des technologies numériques au service de l’apprentissage.  Cette opportunité pédagogique n’existe pas, du moins à ce niveau, dans toutes les institutions d’enseignement supérieur. Par ailleurs, entre institutions disposant de tels centres de pédagogique, des redondances existent, par manque de mise en commun.
•	La collaboration est au cœur des pratiques liées à l’Open. La mettre en pratique au sein de l’OLL selon les principes fondateurs énoncés ci-dessous est le choix que nous posons pour adresser la durabilité de nos initiatives. 

Le plan de relance a été pour nous  l’occasion de développer une déclinaison de notre stratégie en matière d’Open Education sous l’angle de la formation et de l’accompagnement de compétences numériques des enseignants.  Nous sommes convaincus que le modèle proposé, ouvert, simple et collaboratif est transférable dans d’autres contextes et à d’autres institutions. 

Refs :
- (1) https://hdl.handle.net/20.500.12279/819

-  Deville, Y. et Jacqmot C. Stratégies Open Education et Open Science à l’UCLouvain (Open Education Strategies at UC Louvain) ; OE Global 2021 Online Conference
https://connect.oeglobal.org/t/strategies-open-education-et-open-science-a-l-uclouvain-open-education-strategies-at-uc-louvain/2611"
AWJHWV,Pour un renforcement des capacités des acteurs de la politique de transformation numérique de l'enseignement supérieur en Afrique francophone,"Jacques Dang, Anaïs Røed Malbrand",Auditorium 450,2022-05-23T12:20:00+00:00,french,"Intervenants :
1)	Jacques Dang, L’Université Numérique
2)	Anaïs Malbrand, ICDE
3)	Carole Schorlé-Stefan, Université Ouverte des Humanités

La session est axée sur les conditions de la définition et de la mise en oeuvre de stratégies numériques nationales pour l'enseignement supérieur en Afrique francophone, en s'inspirant d'initiatives en cours
Elle traitera;
- le contexte national ou régional
- les caractéristiques de l'éco-système (juridique, réglementaire, économique, culturel, organisation administrative ...)
- la diversité des acteurs publics et para-publics et la nécessité d'une coordination harmonieuse de leurs actions
avant de présenter un projet de ressources éducatives libres intégrées dans une formation destinée à la gouvernance des universités et aux administrations centrales des ministères pour la transformation numérique de l'enseignement supérieur.

Plusieurs pays francophones d’Afrique sub-saharienne ont engagé un processus de définition d’une stratégie pour la transformation numérique de l’enseignement supérieur. Cette stratégie nationale peut, en outre, être articulée avec un plan national de développement, qui identifie le développement économique et la montée en compétences de la population active comme des enjeux cruciaux pour le pays.

Des initiatives sont engagées, par exemple au niveau national comme au Togo, ou au niveau sous-régional, pour quatre pays du Sahel avec le soutien du bureau de Dakar de l’UNESCO ou des acteurs de la coalition dynamique pour les ressources éducatives libres. 

Ces initiatives s’inscrivent dans un cadre socio-culturel, économique et juridique qui est marqué par un ensemble de points communs :
-	Un cadre juridique du droit civil, avec le droit d’auteur plutôt que le copyright, et notamment un droit moral inaliénable qui permet le retrait d’une ressource éducative par son auteur
-	Un cadre économique caractérisé, d’une part, par des droits patrimoniaux qui sont limités par l’exercice possible du droit de retrait par l’auteur et, d’autre part, par un volume de ressources éducatives libres plus limité que dans le monde anglophone
-	Un cadre socio-culturel où l'enseignement supérieur est une mission d'intérêt général avant d'être un marché
-	Un enseignement supérieur où le rôle des universités publiques et du ministère de l’enseignement supérieur demeure prépondérant, où le statut des auteurs relève souvent du statut de fonctionnaire ou d’agent public ; il en résulte un encadrement de l’exercice du droit d’auteur et une problématique de motivation des auteurs dans la durée.
La pérennisation de l’accès aux ressources éducatives libres, à laquelle s’ajoutent les défis de mise à jour de technologies qui peuvent devenir obsolètes (exemple de Flash) et de contenus (mise à jour du cadre législatif ou règlementaire, exemple de Bâle 3 pour la réglementation bancaire) repose donc aussi bien sur la bonne volonté de l’auteur que sur des considérations purement économiques.
Définir et mettre en œuvre une stratégie nationale de transformation numérique pour l’enseignement supérieur nécessite ainsi l’expression d’une volonté politique et la mise en harmonie de politiques qui ne se limitent pas au secteur de l’enseignement supérieur. Voici quelques-uns des acteurs indispensables :
-	Continuum avec l’enseignement secondaire : ministère de l’éducation nationale
-	Continuum avec la formation professionnelle : ministère du travail
-	Licences et droits d’auteur :
o	Statuts des auteurs agents publics : ministère de la fonction publique, ministères de tutelle des écoles nationales
o	Droit d’auteur et ses évolutions possibles :
	Ministère de la culture
	Ministère du commerce extérieur et des affaires étrangères, représentation auprès d’agences des Nations Unies basées à Genève
•	OMPI
•	OMC, TRIPS (trade related aspects of intellectual property rights)
-	Normes et standards : ministères travaillant avec
o	les agences de normalisation membres de l’ISO
o	CEN workshop au niveau européen
o	AICC, IEEE, IETF, IMS

Enfin, à la différence des états qui pratiquent le « spoil system » à chaque changement de gouvernement, il y a dans les pays francophones une relative stabilité des directions d’administration centrale, ce qui permet une continuité dans la mise en œuvre de politiques nationales de caractère non partisan, comme l’est normalement la transformation numérique de l’enseignement supérieur.

Le contexte des pays francophones d’Afrique sub-saharienne se prête donc bien à la définition et à la mise en œuvre d’une stratégie nationale à la triple condition :
-	d’être transversale au niveau des administrations centrales des ministères, donc être interministérielle
-	de reposer sur une collaboration étroite entre le niveau interministériel et la gouvernance des universités publiques, mais aussi privées
-	de supprimer les goulets d’étranglement juridiques et administratifs, ce qui permet, en complément de cette stratégie « top-down », de libérer l’initiative des auteurs et enseignants dans des initiatives horizontales et « bottom-up »

Après avoir adapté un premier cours sur « le droit d’auteur, le copyright et les licences libres », le groupe de travail francophone sur les REL animé par ICDE, le Ministère français de l’Enseignement Supérieur, de la Recherche et de l’Innovation et L’Université Numérique (France) va lancer la réalisation d’un ensemble de ressources éducatives libres, assemblées dans un cursus de formation permettant de renforcer les capacités des acteurs (gouvernance des universités, directeurs de programmes, hauts fonctionnaires). Ce cursus a pour objectif de permettre à ces acteurs de travailler ensemble à la définition et à la mise en œuvre effective de la transformation numérique de l’enseignement supérieur et au développement de l’éducation ouverte et à distance."
BXUD8L,L'enseignement supérieur de gestion au défi de la pandémie,Christophe Fournier,Auditorium 450,2022-05-23T12:40:00+00:00,french,"L’enseignement supérieur de gestion au défi de la pandémie
Intervenants :
-	Christophe Fournier, Président AUNEGe, Université de Montpellier, France
-	Amadou Diawara, Président de l’Université Virtuelle du Mali, Mali
-	Yasmine SY SARR, Directrice du Développement Stratégique & Qualité, Directrice Académique, Supdeco Dakar, Sénégal
-	Deborah Arnold, Universitat Oberta de Catalunya, Espagne
Comme l’ensemble des institutions d’enseignement supérieur, les établissements de formation au management ont été confrontés au défi de la continuité pédagogique dans le contexte pandémique. 
Engagés de longue date dans la transformation pédagogique (pédagogie active, pédagogie par projet, méthode des cas), dans la compétition internationale (classements) et dans la formation professionnelle (Executive education) et cela, avant beaucoup d’autres champs disciplinaires, ils ont dû, néanmoins, généraliser, en très peu de temps, la transformation numérique des enseignements qui, dans les écoles d’ingénieurs, par exemple, irriguait de plus nombreux cursus de formation.
L’objectif de cette session est d’explorer, à partir de l’expérience de formations au management, dans l’enseignement supérieur public, consulaire et privé, en France et dans le monde francophone, les voies et méthodes qui ont permis aux enseignants et aux étudiants, comme aux services de support des établissements d’assurer la continuité pédagogique. Elle s’intéressera plus précisément aux thématiques suivantes :
-	Comment « emergency remote teaching » et « e-learning » traditionnel ont été combinés pour assurer la continuité pédagogique pour les étudiants en formation initiale
-	Comment les ressources éducatives libres et l’enrichissement des pédagogies actives par les technologies du numérique ont contribué à maintenir, à distance, les mobilités entrantes et sortantes, dans le cadre d’échanges comme dans celui de diplômes communs, éléments clé des formations supérieures au management
-	Comment la formation professionnelle a renforcé sa transformation en s’appuyant notamment sur l’approche par compétences et la micro-certification
-	Comment de nouvelles pistes se sont dessinées dans le cadre d’un agenda de recherche pour l’innovation pédagogique dans l’enseignement supérieur de gestion"
38SBQU,Vers des scénarios ouverts pour une pédagogie numérique égalitaire,Lilia Cheniti,Auditorium 450,2022-05-23T13:00:00+00:00,french,"Durant la crise du Covid-19, nous avons observé que l’éducation ouverte a été une opportunité majeure pour d’innombrables communautés de pratiques, notamment en milieux défavorisés, afin de bénéficier d’un accès aux ressources pédagogiques pour assurer une continuité pédagogique. 
L’offre de l’éducation ouverte a non seulement permis de préserver le rôle de l’éducation comme vecteur de développement durable pour les milieux défavorisés, mais elle a aussi permis aux formateurs et aux apprenants de découvrir un gigantesque potentiel de ressources, de moyens, de services et de facilités pédagogiques multidisciplinaires et multilingues accessibles gratuitement.  
Les Objectifs de Développement Durable (ODD) sont 17 objectifs mondiaux que les États s’engagent à atteindre au cours des prochaines années. Adoptés le 25 janvier 2015, ils portent sur une multitude de domaines allant de la protection de la planète à l’édification d’un monde plus pacifique, en passant par la garantie donnée à tous de pouvoir vivre en sécurité et dans la dignité. Il est ainsi important de veiller à promouvoir ces objectifs à travers les parcours académiques dans les universités, de manière à garantir l’adhésion des jeunes à ces ODD. 
C’est dans ce cadre que le projet Open2Sustain qui s’inspire fortement de l’ODD4 des Nations unies pour le développement durable, dont les fondements consistent à “assurer l’accès de tous à une éducation de qualité, sur un pied d’égalité, et promouvoir les possibilités d’apprentissage tout au long de la vie”, a été conçu et mis en place. Le projet est de type recherche-action qui met en synergie des partenaires universitaires de pays euro-méditerranéens autour d’une problématique liée aux ODD.  L’idée centrale est de concevoir un processus d’appropriation des ODD par un public universitaire en développant des procédés inhérents à l’éducation ouverte et des scénarios pédagogiques ouverts et innovants. Plus précisément, ce projet permet de créer une synergie de coopération Nord-Sud qui permettra de mutualiser des expériences pédagogiques innovantes, d’appuyer la co-construction des connaissances de développement durable, en vue de mettre en place un plan d‘action d’intégration des ODD dans les parcours académiques. 
La perspective d'œuvrer pour un croisement entre éducation ouverte et développement durable dans le cadre d’un projet de recherche-action, nous est aussitôt paru comme un vecteur stratégique important pour une nouvelle forme de coopération euro-méditerranéenne. La mise en place d’un espace d’échange est à double orientation : l’harmonisation inter-culturelle de l'acceptation des ODD sur un fond de renforcement de la collaboration entre des cultures et des langues différentes et le développement d’un mouvement de plaidoyer scientifique pouvant réaliser une adhésion massive, des communautés des formateurs et des apprenants, autour des ODD. Nous focalisons d’abord sur des scénarios ouverts relatifs à l’intégration de le ODD5 « Egalité entre des sexes » dans les parcours universitaires. 
Il s’agit de créer d’un réseau de facilitateurs autour du ODD 5 dans la région euro-méditerranéenne, à travers l’élaboration d’un syllabus d’un SPOC sur le ODD 5 et le partage de scénarios innovants ouverts se basant sur des ressources éducatives libres.  Nous avons en effet observé qu’au cours des dernières années la connaissance et l'apprentissage sont distribués et se produisent dans un monde sans frontières. En effet avec le développement des technologies de l’information et de la communication (TIC) et du Web, les producteurs de contenus éducatifs partagent de plus en plus librement leurs ressources pédagogiques [2]. Cette notion de partage de contenus accessibles sur le web est connue sous le nom de contenu ouvert ou l’Open Content [4, 5]. De plus, l'ouverture des ressources sur les différentes connaissances et la nature sociale du Web, très visible par la participation, la collaboration, l'agrégation et la distribution, conduisent à une nouvelle génération d'apprentissage, motivée par l'ouverture, le réseautage et le partage. L'apprentissage ouvert améliore en effet les attitudes des élèves et développe la réflexion et l'implication de l'élève dans le processus d'apprentissage.
Il y a donc un énorme besoin de concevoir et de fournir des services de soutien, efficaces à l'apprentissage en ligne, ouverts orientés à la fois aux enseignants et aux étudiants. Une démarche se basant sur processus de Design, Based Research [1] a été mise en place permettant d’impliquer les différents intervenants dans le SPOC (Gouvernance, Personnel académique, Etudiants). Dans le cadre de cette communication, nous décrivons notre démarche d’analyse de besoins en formation académique autour des ODD permettant la création de scénarios ouverts se basant sur la pédagogie égalitaire. Nous détaillons par la suite le processus de conception du SPOC proposant des scénarios pédagogiques ouverts pour intégrer l’ODD 5 dans les parcours académiques et ce en se basant sur la méthodologie ADDIE.

Mots clés : Pédagogie ouverte, ODD, Pédagogie égalitaire, Innovation Pédagogique, SPOC

Références 
[1] Éric Sanchez, Réjane Monod-Ansaldi, « Recherche collaborative orientée par la conception », Éducation et didactique, 9-2 | 2015, 73-94
[2] Hiba Hajri. Personnalisation des MOOC par la réutilisation de Ressources Éducatives Libres. Autre [cs.OH]. Université Paris-Saclay, 2018. Français. NNT : 2018SACLC046. tel-01849443
[3] Li Yuan, Sheila MacNeill et Willem G Kraan. «Open Educational Resources -Opportunities and challenge sfor higher education». In:(2008).
[4] Toru Iiyoshi et MS Vijay Kumar. Opening up education: The collective advancement of education through open technology, open content, and open knowledge. MitPress,2008.
[5] Tom Caswell et al. «Open content and open educational resources: Enabling universal education». In: The International Review of Research in Open and Distributed Learning 9.1 (2008)."
